{
  "schema_version": "m1",
  "node_id": "execute-1",
  "workflow_revision_id": "workflow-rev-approval-001",
  "policy_bundle_digest": "policy-bundle-digest-approval-001",
  "artifact_lifecycle_state": "compiled",
  "bound_tools": [
    {
      "tool_name": "local-file-writer",
      "access_mode": "write",
      "binding_type": "builtin"
    }
  ],
  "bound_connectors": [
    {
      "connector_name": "fixture-catalog",
      "scope": "read:fixtures/approval-required",
      "binding_ref": "connector-binding:fixture-catalog:read:fixtures/approval-required"
    }
  ],
  "bound_permissions": [
    {
      "permission": "write",
      "target": "runs/approval-required-workflow",
      "binding_ref": "permission-binding:write:runs/approval-required-workflow"
    }
  ],
  "env_bindings": []
}
